{
  "version": "1.0",
  "repo": "ivannikov-pro/ai-agent-kit",
  "skills": {
    "business-analysis": {
      "source": "local:skills/business-analysis",
      "description": "Фреймворки бизнес-анализа перед проектом — JTBD, Lean Canvas, Value Proposition Canvas. Use when conducting Discovery sessions, formulating outcome-oriented offers, or analyzing client business models.",
      "category": "business",
      "tags": [
        "jtbd",
        "lean-canvas",
        "value-proposition",
        "discovery",
        "business"
      ],
      "risk": "safe",
      "version": "1.0.0"
    },
    "client-communication": {
      "source": "local:skills/client-communication",
      "description": "Outcome-ориентированная коммуникация с клиентом — Discovery-звонки, статусы, презентация результатов. Use when preparing for client meetings, writing status updates, or presenting project results.",
      "category": "business",
      "tags": [
        "communication",
        "discovery",
        "status-update",
        "client",
        "outcome"
      ],
      "risk": "safe",
      "version": "1.0.0"
    },
    "context7-mcp": {
      "source": "local:skills/context7-mcp",
      "description": "Retrieves authoritative, up-to-date technical documentation, API references, configuration details, and code examples for any developer technology. Use this skill whenever answering technical questions or writing code that interacts with external technologies. This includes libraries, frameworks, programming languages, SDKs, APIs, CLI tools, cloud services, infrastructure tools, and developer platforms.\nCommon scenarios: - looking up API endpoints, classes, functions, or method parameters - checking configuration options or CLI commands - answering \"how do I\" technical questions - generating code that uses a specific library or service - debugging issues related to frameworks, SDKs, or APIs - retrieving setup instructions, examples, or migration guides - verifying version-specific behavior or breaking changes\nPrefer this skill whenever documentation accuracy matters or when model knowledge may be outdated.",
      "category": "development",
      "tags": [
        "context7",
        "mcp",
        "documentation",
        "api-reference",
        "code-examples",
        "find-docs"
      ],
      "risk": "safe",
      "version": "1.0.0"
    },
    "custom-formatting": {
      "source": "local:skills/custom-formatting",
      "description": "How to use ESLint v9 Flat Config with @stylistic/eslint-plugin to enforce custom padding (like 3 blank lines after imports) instead of Prettier. Use when configuring or fixing formatting rules in this workspace.",
      "category": "development",
      "tags": [
        "eslint",
        "stylistic",
        "prettier",
        "formatting",
        "ast"
      ],
      "risk": "safe",
      "version": "1.0.0"
    },
    "express-v5": {
      "source": "local:skills/express-v5",
      "description": "How to use Express v5 — async errors, removed APIs, path syntax, middleware. Use when building HTTP servers with Express.",
      "category": "development",
      "tags": [
        "express",
        "http",
        "node",
        "api",
        "middleware"
      ],
      "risk": "safe",
      "version": "1.0.0"
    },
    "figma-api": {
      "source": "local:skills/figma-api",
      "description": "How to extract design data from Figma REST API — tokens, SVG icons, images, layout specs. Use when setting up design-to-code pipeline or updating design assets from Figma.",
      "category": "design",
      "tags": [
        "figma",
        "design-tokens",
        "svg",
        "design-system",
        "extraction",
        "svgr",
        "react-icons"
      ],
      "risk": "safe",
      "version": "1.0.0"
    },
    "find-docs": {
      "source": "local:skills/find-docs",
      "description": "Retrieves authoritative, up-to-date technical documentation, API references, configuration details, and code examples for any developer technology. Use this skill whenever answering technical questions or writing code that interacts with external technologies. This includes libraries, frameworks, programming languages, SDKs, APIs, CLI tools, cloud services, infrastructure tools, and developer platforms.\nCommon scenarios: - looking up API endpoints, classes, functions, or method parameters - checking configuration options or CLI commands - answering \"how do I\" technical questions - generating code that uses a specific library or service - debugging issues related to frameworks, SDKs, or APIs - retrieving setup instructions, examples, or migration guides - verifying version-specific behavior or breaking changes\nPrefer this skill whenever documentation accuracy matters or when model knowledge may be outdated.",
      "category": "development",
      "tags": [
        "context7",
        "mcp",
        "documentation",
        "api-reference",
        "code-examples",
        "find-docs"
      ],
      "risk": "safe",
      "version": "1.0.0"
    },
    "monorepo-conventions": {
      "source": "local:skills/monorepo-conventions",
      "description": "Monorepo structure, tooling conventions, and development practices for the ivannikov-pro-platform. Use when adding packages, configuring builds, or understanding project architecture.",
      "category": "development",
      "tags": [
        "monorepo",
        "pnpm",
        "turborepo",
        "architecture",
        "conventions"
      ],
      "risk": "safe",
      "version": "2.0.0"
    },
    "node-app-config": {
      "source": "local:skills/node-app-config",
      "description": "How to add and use @ivannikov-pro/app-config — convict-based config with dotenv, schema validation. Use when adding configuration management to a package.",
      "category": "development",
      "tags": [
        "config",
        "convict",
        "dotenv",
        "validation",
        "node"
      ],
      "risk": "safe",
      "version": "1.0.0"
    },
    "node-app-logger": {
      "source": "local:skills/node-app-logger",
      "description": "How to add and use @ivannikov-pro/app-logger — log4js-based logging with convict integration. Use when adding logging to a package.",
      "category": "development",
      "tags": [
        "logging",
        "log4js",
        "convict",
        "node",
        "observability"
      ],
      "risk": "safe",
      "version": "1.0.0"
    },
    "outcome-pricing": {
      "source": "local:skills/outcome-pricing",
      "description": "Value-based pricing — ценообразование на основе бизнес-результата, а не часов работы. Use when preparing commercial proposals, justifying project costs, or switching from hourly to value-based pricing.",
      "category": "business",
      "tags": [
        "pricing",
        "value-based",
        "proposal",
        "business",
        "roi"
      ],
      "risk": "safe",
      "version": "1.0.0"
    },
    "pnpm-workspaces": {
      "source": "local:skills/pnpm-workspaces",
      "description": "How to use pnpm workspaces — workspace protocol, filter, publishing. Use when managing workspace dependencies or packages.",
      "category": "development",
      "tags": [
        "pnpm",
        "workspaces",
        "monorepo",
        "dependencies",
        "package-manager"
      ],
      "risk": "safe",
      "version": "1.0.0"
    },
    "skill-base": {
      "source": "local:skills/skill-base",
      "description": "How to create, maintain, and distribute AI agent skills. Use when creating new skills, updating existing ones, or setting up skill infrastructure in a project.",
      "category": "meta",
      "tags": [
        "skill-base",
        "meta-skill",
        "agentskills",
        "multi-agent",
        "scaffolding"
      ],
      "risk": "safe",
      "version": "1.1.0"
    },
    "solidity-contracts": {
      "source": "local:skills/solidity-contracts",
      "description": "Conventions and architecture for Solidity smart contracts in this project (packages/contracts). Covers contract structure, standards, tooling, and deployment patterns. Use when writing, reviewing, or deploying Solidity code.",
      "category": "development",
      "tags": [
        "solidity",
        "foundry",
        "hardhat",
        "erc1155",
        "erc721a",
        "upgradeable",
        "bsc"
      ],
      "risk": "safe",
      "version": "1.1.0"
    },
    "tsup": {
      "source": "local:skills/tsup",
      "description": "How to use tsup — zero-config TypeScript bundler powered by esbuild. Use when bundling TypeScript packages or configuring build output.",
      "category": "development",
      "tags": [
        "tsup",
        "esbuild",
        "bundler",
        "typescript",
        "build"
      ],
      "risk": "safe",
      "version": "1.0.0"
    },
    "turborepo": {
      "source": "local:skills/turborepo",
      "description": "How to use Turborepo — monorepo build system with task caching and dependency graph. Use when configuring or running monorepo tasks.",
      "category": "development",
      "tags": [
        "turborepo",
        "monorepo",
        "build",
        "cache",
        "pipeline"
      ],
      "risk": "safe",
      "version": "1.0.0"
    }
  },
  "workflows": {
    "architecture": {
      "source": "local:workflows/architecture",
      "description": "How to keep the architecture document (docs/ARCHITECTURE.md) up to date after making changes",
      "category": "architecture",
      "tags": []
    },
    "as-blockchain": {
      "source": "local:workflows/as-blockchain",
      "description": "Act as Blockchain / Smart Contract Engineer — Solidity, Foundry, gas optimization, indexer-awareness",
      "category": "general",
      "tags": []
    },
    "as-cto": {
      "source": "local:workflows/as-cto",
      "description": "Act as CTO / Tech Lead — architecture, code review, risk assessment, standards",
      "category": "code-quality",